{
  "spec": "SourceSpec/1",
  "id": "alpaca",
  "version": "0.3.0",
  "vendor": "alpaca",
  "caveat": "Alpaca's own Market Data API, relayed unread — bars, corporate actions, snapshots and news. No dates are checked, nothing is bounded by asOf, and the shape is Alpaca's to change. Whether a bar series is adjusted is the `adjustment` parameter's answer, not this document's — and `corporate-actions` is the only endpoint here that lets a caller check that answer against the dividends and splits it claims to have applied. Two of these take a date range and two do not: `snapshots` and the bars of a snapshot are always now, whatever instant the caller is judging.",
  "hosts": ["data.alpaca.markets"],
  "headers": {
    "accept": "application/json"
  },
  "credentials": [
    {
      "name": "api-key-id",
      "header": "APCA-API-KEY-ID"
    },
    {
      "name": "api-secret-key",
      "header": "APCA-API-SECRET-KEY"
    }
  ],
  "endpoints": [
    {
      "host": "data.alpaca.markets",
      "path": "/v2/stocks/bars",
      "query": [
        "symbols",
        "timeframe",
        "start",
        "end",
        "limit",
        "feed",
        "adjustment",
        "sort",
        "page_token",
        "asof"
      ]
    },
    {
      "host": "data.alpaca.markets",
      "path": "/v2/stocks/snapshots",
      "query": ["symbols", "feed"]
    },
    {
      "host": "data.alpaca.markets",
      "path": "/v1/corporate-actions",
      "query": [
        "symbols",
        "types",
        "start",
        "end",
        "limit",
        "sort",
        "page_token",
        "region",
        "data_quality"
      ]
    },
    {
      "host": "data.alpaca.markets",
      "path": "/v1beta1/news",
      "query": ["symbols", "start", "end", "limit", "sort", "include_content", "page_token"]
    }
  ]
}
