{
  "spec": "SourceSpec/1",
  "id": "fsc-securities-product",
  "version": "0.1.0",
  "vendor": "fsc-securities-product",
  "caveat": "금융위원회's 증권상품시세정보, relayed unread — the Korea Exchange's own ETF numbers by way of 공공데이터포털. `clpr` is the traded close and is not adjusted; `nav` is not back-adjusted either, so neither series is a total return and a distribution leaves a step in both. What this document is for is `nav`, `bssIdxClpr`, `nPptTotAmt` and `stLstgCnt`: premium to NAV, tracking against the index, and fund size. Dates are the caller's — `basDt` matches one day, `beginBasDt`/`endBasDt` a range, and nothing is bounded by asOf. History begins 2020-01-02. An error arrives as `resultCode` on a 200.",
  "hosts": ["apis.data.go.kr"],
  "headers": {
    "accept": "application/json"
  },
  "credentials": [
    {
      "name": "service-key",
      "inject": {
        "location": "query",
        "name": "serviceKey"
      },
      "required": true
    }
  ],
  "endpoints": [
    {
      "host": "apis.data.go.kr",
      "path": "/1160100/service/GetSecuritiesProductInfoService/getETFPriceInfo",
      "query": [
        "numOfRows",
        "pageNo",
        "resultType",
        "basDt",
        "beginBasDt",
        "endBasDt",
        "likeBasDt",
        "likeSrtnCd",
        "isinCd",
        "likeIsinCd",
        "itmsNm",
        "likeItmsNm",
        "beginVs",
        "endVs",
        "beginFltRt",
        "endFltRt",
        "beginNav",
        "endNav",
        "beginTrqu",
        "endTrqu",
        "beginTrPrc",
        "endTrPrc",
        "beginMrktTotAmt",
        "endMrktTotAmt",
        "bssIdxIdxNm",
        "likeBssIdxIdxNm"
      ]
    }
  ]
}
