{
  "spec": "SourceSpec/1",
  "id": "sec-edgar",
  "version": "0.3.3",
  "vendor": "sec-edgar",
  "caveat": "SEC EDGAR's own endpoints, relayed unread. The `{symbol}` segment of `companyfacts` is a filename and not a ticker: it must be `CIK` + the ten-digit zero-padded CIK + `.json` (`CIK0000050863.json`), and a ticker there answers 404. So `/files/company_tickers.json` is a precondition of this path and not only a mapping table; its `cik_str` is an integer the caller pads. `companyfacts` is a filer's whole XBRL history; nothing here is bounded by asOf and nothing is dated by Aumos, so reading the filing dates out is the caller's work. SEC requires a contactable caller; that is the credential.",
  "hosts": ["www.sec.gov", "data.sec.gov"],
  "headers": {
    "accept": "application/json"
  },
  "credentials": [
    {
      "name": "user-agent",
      "header": "user-agent",
      "default": "Aumos/0.2 (ops@aumos.app)",
      "required": true
    }
  ],
  "endpoints": [
    {
      "host": "www.sec.gov",
      "path": "/files/company_tickers.json",
      "query": []
    },
    {
      "host": "data.sec.gov",
      "path": "/api/xbrl/companyfacts/{symbol}",
      "query": []
    }
  ]
}
